run_timestamp,ticker,score,summary
2026-04-28T14:34:07,AAPL,0.6,UBS raises price target on iPhone share gains ahead of earnings.
2026-04-28T14:34:07,NVDA,-0.6,OpenAI spending concerns weigh on AI chip demand outlook.
2026-04-28T14:34:07,TSLA,0.1,Analyst upside offset by autonomy execution risk and regulatory scrutiny.
2026-04-28T14:34:07,MSFT,0.2,Earnings report imminent; AI spending concerns offset bullish setup.
2026-04-28T14:34:07,AMZN,0.2,"Q1 earnings week with AI spending focus, offset by OpenAI miss concerns."
