run_timestamp,ticker,score,summary
2026-07-20T14:24:18,AAPL,0.4,BofA expects earnings beat; offset by AI spending concerns.
2026-07-20T14:24:18,NVDA,0.2,Modest rebound in AI chip stocks; AMD gains on Microsoft partnership.
2026-07-20T14:24:18,TSLA,0.0,Earnings week ahead; investors await robotaxi and Optimus spending details.
2026-07-20T14:24:18,MSFT,0.3,Major AMD Helios AI infrastructure deal expands Azure capabilities.
2026-07-20T14:24:18,AMZN,0.3,AI cloud investment thesis intact; ROI crossover moment ahead for Amazon.
2026-07-19T20:41:59,AAPL,0.6,"Apple Intelligence China approval, strong momentum, all-time high despite legal headwinds."
2026-07-19T20:41:59,NVDA,0.6,Major Rubin GPU deal with Japan signals strong enterprise demand growth.
2026-07-19T20:41:59,TSLA,0.0,Upcoming earnings report with mixed analyst expectations and competitive pressure.
2026-07-19T20:41:59,MSFT,-0.6,Heavy AI spending exceeds current revenue; $1.2T market value decline.
2026-07-19T20:41:59,AMZN,0.6,AI capex investment validated; grocery expansion and chip business growth.
2026-07-19T16:59:41,AAPL,0.6,HSBC analyst upgrade flags operational turning point; record highs amid AI positioning.
2026-07-19T16:59:41,NVDA,-0.3,Korean brokerage downgrade triggers chip sector selloff; NVIDIA shares decline.
2026-07-19T16:59:41,TSLA,0.1,Earnings week ahead; mixed analyst views on valuation and growth drivers.
2026-07-19T16:59:41,MSFT,-0.5,Job cuts and massive AI spending exceed current revenue generation.
2026-07-19T16:59:41,AMZN,0.3,"Price cuts on 13,000 grocery items; AI chip business validates $200B investment."
2026-07-19T13:40:21,AAPL,0.4,Apple upgraded by HSBC as operational turning point; Services growth accelerates.
2026-07-19T13:40:21,NVDA,-0.3,AMD surpasses NVDA in chip ETF; earnings season scrutiny ahead.
2026-07-19T13:40:21,TSLA,0.2,Tesla earnings week amid geopolitical uncertainty; mixed analyst views.
2026-07-19T13:40:21,MSFT,-0.3,Heavy AI spending outpacing revenue; stock down 27% from highs.
2026-07-19T13:40:21,AMZN,0.6,AI investment justified by strong Trainium chip business growth.
2026-07-18T20:41:02,AAPL,0.3,New Siri AI and Apple Intelligence drive record stock high.
2026-07-18T20:41:02,NVDA,0.3,AI spending surge and memory bottleneck create mixed tailwinds and headwinds.
2026-07-18T20:41:02,TSLA,0.3,Record Q2 deliveries; profit margins key to earnings catalyst.
2026-07-18T20:41:02,MSFT,-0.3,Stock underperformance amid AI capex concerns and competitive positioning questions.
2026-07-18T20:41:02,AMZN,0.2,Heavy AI capex spending and new infrastructure competition emerging.
2026-07-18T16:59:32,AAPL,0.3,New Siri AI beta and Apple Intelligence drive record stock high.
2026-07-18T16:59:32,NVDA,0.0,Mixed AI sector sentiment; no direct NVDA catalyst identified.
2026-07-18T16:59:32,TSLA,0.2,"Record Q2 deliveries offset by competitive EV pressure, earnings ahead."
2026-07-18T16:59:32,MSFT,0.2,Microsoft pushes in-house AI models; broad tech sector uncertainty on AI capex returns.
2026-07-18T16:59:32,AMZN,0.2,AI infrastructure investment and battery supply deal offset debt concerns.
2026-07-18T13:37:46,AAPL,-0.3,AI strategy concerns offset by strong valuation and core business strength.
2026-07-18T13:37:46,NVDA,-0.3,Tech sell-off pushes NVDA lower; Apple reclaims most valuable company.
2026-07-18T13:37:46,TSLA,0.2,Record Q2 deliveries offset by intensifying EV competition globally.
2026-07-18T13:37:46,MSFT,0.2,AI strategy shift; mixed market sentiment on cloud and AI investments.
2026-07-18T13:37:46,AMZN,0.3,Amazon leading $182B AI infrastructure investment; battery supply deal signed.
2026-07-17T20:48:45,AAPL,0.6,AI upgrade cycle and reclaimed market cap leader position.
2026-07-17T20:48:45,NVDA,-0.6,"AI spending concerns, market rotation away from chip capex leaders."
2026-07-17T20:48:45,TSLA,-0.3,Competitive pressure from Rivian software and Lucid rally; awaiting Q2 earnings.
2026-07-17T20:48:45,MSFT,-0.3,Broad market sell-off and semiconductor weakness; AI narrative questions cloud growth.
2026-07-17T20:48:45,AMZN,0.3,Amazon beats Starlink on satellite internet licensing; custom AI chip strategy competitive.
2026-07-17T17:14:21,AAPL,0.3,Apple reclaims most valuable company; antitrust settlement talks ongoing.
2026-07-17T17:14:21,NVDA,-0.3,Market rotation away from AI chips; Apple reclaims top valuation spot.
2026-07-17T17:14:21,TSLA,0.3,Robotaxi momentum and BofA Buy rating offset growth slowdown concerns.
2026-07-17T17:14:21,MSFT,0.6,"60+ analysts bullish; $37B AI run rate, doubled backlog support valuation."
2026-07-17T17:14:21,AMZN,0.6,CEO's $25B AI data center investment signals strong AI infrastructure commitment.
2026-07-17T13:54:40,AAPL,0.6,Multiple analyst upgrades on AI capabilities and strong product pipeline ahead.
2026-07-17T13:54:40,NVDA,-0.3,Semiconductor sector selloff amid AI jitters and risk-off sentiment.
2026-07-17T13:54:40,TSLA,0.1,Earnings report July 22 with mixed sentiment; robotaxi competition concerns offset.
2026-07-17T13:54:40,MSFT,-0.3,CEO criticizes competitor's AI model; broader AI ROI concerns emerge.
2026-07-17T13:54:40,AMZN,0.2,AI spending focus amid tech sector volatility and valuation concerns.
2026-07-16T20:52:36,AAPL,0.6,China approves Apple Intelligence; higher iPhone prices support margins.
2026-07-16T20:52:36,NVDA,0.2,"AI demand strong, but NVDA underperforming peers; valuation concerns."
2026-07-16T20:52:36,TSLA,0.2,Surprise delivery beat offset by valuation concerns and merger speculation.
2026-07-16T20:52:36,MSFT,0.6,"Microsoft AI models reduce costs, compete with OpenAI and rivals."
2026-07-16T20:52:36,AMZN,0.6,AI data center cost advantage; analysts project 32% upside potential.
2026-07-16T17:18:58,AAPL,0.6,iPhone AI features approved in China; regulatory green light for AI strategy.
2026-07-16T17:18:58,NVDA,0.6,TSMC capex raise signals strong AI chip demand; Nvidia expands Japan partnerships.
2026-07-16T17:18:58,TSLA,0.1,"Mixed signals: EV adoption tailwinds offset by affordability concerns, valuation questions."
2026-07-16T17:18:58,MSFT,-0.3,Stock down 20% YTD; AI spending hasn't delivered expected returns yet.
2026-07-16T17:18:58,AMZN,0.6,AI spending strength and analyst preference for Amazon's cloud position.
2026-07-16T14:10:46,AAPL,0.6,"Apple Intelligence approved for China launch with Alibaba, Baidu partnership."
2026-07-16T14:10:46,NVDA,0.3,"TSMC, ASML raise forecasts; AI chip demand strong but TSMC stock tumbles."
2026-07-16T14:10:46,TSLA,0.1,"Mixed signals: FSD cleared in crash, earnings ahead, SpaceX acquisition speculation."
2026-07-16T14:10:46,MSFT,0.6,Microsoft emerging as clear AI beneficiary; CIO budget growth favors cloud.
2026-07-16T14:10:46,AMZN,0.3,Amazon-backed Anthropic seeks billions in credit ahead of IPO.
2026-07-15T20:55:14,AAPL,0.2,Rising chip costs offset by AI chip strategy and China market expansion.
2026-07-15T20:55:14,NVDA,0.3,ASML forecast lift signals strong AI chip equipment demand tailwinds.
2026-07-15T20:55:14,TSLA,-0.3,Valuation concerns offset semi partnership; analyst downgrade weighs sentiment.
2026-07-15T20:55:14,MSFT,-0.3,AI spending pressure offset by Azure demand and strategic security overhaul.
2026-07-15T20:55:14,AMZN,0.6,CEO confirms AI chip demand booming; analyst upgrade to top pick.
2026-07-15T17:19:19,AAPL,-0.3,"AI chip struggles, legal dispute with OpenAI, offset by acquisition strategy."
2026-07-15T17:19:19,NVDA,0.3,ASML demand surge supports AI chip ecosystem; NVDA valued favorably versus AMD.
2026-07-15T17:19:19,TSLA,0.1,"Q2 earnings beat expected, but valuation concerns and analyst skepticism persist."
2026-07-15T17:19:19,MSFT,-0.6,AI spending pressure and analyst price-target cuts ahead of earnings.
2026-07-15T17:19:19,AMZN,0.1,AI spending pressure offset by satellite internet expansion and chip innovation.
2026-07-15T13:58:58,AAPL,0.2,US AI race advantage supports long-term competitive positioning.
2026-07-15T13:58:58,NVDA,0.2,Rubin production on track; hyperscaler AI ROI concerns offset gains.
2026-07-15T13:58:58,TSLA,0.2,"Strong EPS growth expected, but competitive pressure from BYD intensifies."
2026-07-15T13:58:58,MSFT,-0.3,Analyst price cuts ahead of earnings; capex concerns offset strong Q4 outlook.
2026-07-15T13:58:58,AMZN,-0.3,Hyperscaler AI spending pressure; massive capex costs questioned.
2026-07-14T20:55:17,AAPL,-0.65,Multiple analyst downgrades cite slowing iPhone sales and growth concerns.
2026-07-14T20:55:17,NVDA,0.3,Chip profit boom expected by 2027; offset by open-source AI competition concerns.
2026-07-14T20:55:17,TSLA,0.4,Multiple analyst price target hikes ahead of Q2 earnings report.
2026-07-14T20:55:17,MSFT,0.3,Microsoft cheaper than S&P 500; IBM weakness raises enterprise spending concerns.
2026-07-14T20:55:17,AMZN,0.6,AWS momentum and Prime Day spending position AMZN well for Q2 earnings.
2026-07-14T17:16:40,AAPL,0.3,"iPhone strength in China, new models planned, but valuation concerns emerge."
2026-07-14T17:16:40,NVDA,0.2,Profit boom offset by export controls and open-source competition.
2026-07-14T17:16:40,TSLA,0.4,"Strong Q2 deliveries, price target boosts, robotics pivot potential."
2026-07-14T17:16:40,MSFT,0.2,IBM weakness triggers sector selloff; MSFT positioned as cloud leader.
2026-07-14T17:16:40,AMZN,0.5,Wells Fargo raises PT; AWS acceleration expected in Q2.
2026-07-14T14:02:11,AAPL,-0.65,Multiple analyst downgrades cite iPhone weakness and slowing hardware demand.
2026-07-14T14:02:11,NVDA,0.4,Chip profit boom and cash generation; CUDA-Q quantum validation milestone.
2026-07-14T14:02:11,TSLA,0.2,Analyst upgrades offset retail selling; robotics pivot offers long-term upside.
2026-07-14T14:02:11,MSFT,0.3,Microsoft AI infrastructure investments in Portugal data centres expand.
2026-07-14T14:02:11,AMZN,-0.3,Free cash flow decline amid AI pivot raises profitability concerns.
2026-07-13T20:53:17,AAPL,0.3,Record smartphone market share offsets retail selling and AI spending concerns.
2026-07-13T20:53:17,NVDA,-0.3,Chip sector weakness; retail selling; AI spending concerns persist.
2026-07-13T20:53:17,TSLA,0.1,California EV rebate favors Tesla; robot production plans offset retail selling pressure.
2026-07-13T20:53:17,MSFT,-0.3,Tech sector sell-off; Microsoft underperforming amid AI spending concerns.
2026-07-13T20:53:17,AMZN,-0.3,AI capex surge raises ROI concerns; valuation attractive but spending trajectory uncertain.
