run_timestamp,ticker,score,summary
2026-06-25T21:27:49,AAPL,-0.6,Price hikes to offset chip costs; stock plunges 6% amid tech weakness.
2026-06-25T21:27:49,NVDA,0.6,Semiconductor complex rallies on Micron earnings; AI chip demand strengthens.
2026-06-25T21:27:49,TSLA,0.1,Energy coalition and production ramp offset Mag 7 selloff and lawsuit headwinds.
2026-06-25T21:27:49,MSFT,-0.3,Xbox price hikes and tech sector weakness offset data center expansion.
2026-06-25T21:27:49,AMZN,-0.3,Stock slips below 200-day line amid Mag 7 rotation selloff.
2026-06-25T18:11:37,AAPL,-0.7,Apple raises prices 4-6% due to AI-driven memory shortage crisis.
2026-06-25T18:11:37,NVDA,0.6,Micron earnings beat signals strong AI chip demand tailwinds.
2026-06-25T18:11:37,TSLA,0.3,Robotaxi regulatory boost and Optimus humanoid robot momentum offset valuation concerns.
2026-06-25T18:11:37,MSFT,-0.6,Xbox price hikes third time in 13 months; stock hits 14-month low.
2026-06-25T18:11:37,AMZN,-0.3,Stock breaks 200-day line amid cloud sector weakness; offset by India expansion.
2026-06-25T14:47:40,AAPL,-0.7,Apple raises prices 20-25% due to AI-driven memory chip shortage.
2026-06-25T14:47:40,NVDA,-0.3,Broadcom-OpenAI partnership and Qualcomm competition threaten NVDA dominance.
2026-06-25T14:47:40,TSLA,0.3,Major energy deals with power plants and battery storage partnerships.
2026-06-25T14:47:40,MSFT,-0.6,MSFT stock down 24% YTD; AI gains bypass Microsoft despite sector strength.
2026-06-25T14:47:40,AMZN,-0.3,EU gatekeeper designation threat offsets India AI investment gains.
2026-06-24T21:19:27,AAPL,0.3,iPhone 17 cycle momentum; AI upgrade skepticism partially offsets gains.
2026-06-24T21:19:27,NVDA,-0.3,OpenAI-Broadcom AI chip partnership threatens NVDA's GPU dominance.
2026-06-24T21:19:27,TSLA,-0.3,Tech selloff and lawsuit offset renewable energy partnership gains.
2026-06-24T21:19:27,MSFT,0.2,Microsoft benefits from AI infrastructure demand; broader tech sector cooling.
2026-06-24T21:19:27,AMZN,0.6,"Prime Day sales surge, robotaxi updates, and institutional buying support."
2026-06-24T17:56:15,AAPL,0.3,BofA bullish on price increases offsetting memory costs; Intel chip deal strategic.
2026-06-24T17:56:15,NVDA,0.3,CoreWeave deepens Nvidia partnership; OpenAI tests Broadcom chips.
2026-06-24T17:56:15,TSLA,-0.6,Fatal Autopilot crash lawsuit and NHTSA probe offset VPP partnership gains.
2026-06-24T17:56:15,MSFT,-0.3,Big Tech AI capex concerns outweigh chip efficiency gains.
2026-06-24T17:56:15,AMZN,0.6,"Prime Day strong sales, robotaxi updates, AWS partnership expansion."
2026-06-24T14:48:02,AAPL,0.3,Intel chip deal eases supply constraints; BofA maintains buy rating.
2026-06-24T14:48:02,NVDA,-0.3,"Competitive threats from OpenAI-Broadcom chip partnership, supply constraints."
2026-06-24T14:48:02,TSLA,-0.3,Tech sector selloff and AI valuation concerns offset positive fundamentals.
2026-06-24T14:48:02,MSFT,-0.3,Tech sector AI valuation correction; MSFT power deal noted but sector headwinds dominate.
2026-06-24T14:48:02,AMZN,0.0,Prime Day event underway; no material Amazon-specific catalysts identified.
2026-06-23T21:28:25,AAPL,-0.3,UK lawsuit over iCloud services; competitive pressure from Meta AI glasses.
2026-06-23T21:28:25,NVDA,-0.4,AI sector profit-taking; investors demand evidence of returns on spending.
2026-06-23T21:28:25,TSLA,-0.6,"Fatal crash scrutiny, safety probe, and broad tech selloff pressure TSLA."
2026-06-23T21:28:25,MSFT,0.6,Microsoft expands AI data center infrastructure with $4.7B Wisconsin investment.
2026-06-23T21:28:25,AMZN,0.3,Prime Day 2026 event launches with $26B spending forecast.
2026-06-23T17:58:42,AAPL,-0.6,Memory cost inflation forces iPhone price hikes; UK lawsuit threatens iCloud revenue.
2026-06-23T17:58:42,NVDA,-0.3,AI bubble concerns and Big Tech selloff amid mixed market sentiment.
2026-06-23T17:58:42,TSLA,-0.35,Fatal crash probe and regulatory scrutiny offset European battery deal gains.
2026-06-23T17:58:42,MSFT,0.3,Data center expansion and AI model launches offset sector headwinds.
2026-06-23T17:58:42,AMZN,0.3,"Prime Day event, AI infrastructure investment, labor dispute offset gains."
2026-06-23T15:17:35,AAPL,-0.35,Price hikes unavoidable due to memory costs; $4B iCloud lawsuit approved.
2026-06-23T15:17:35,NVDA,0.4,NVDA launches BioNeMo toolkit for AI-driven life sciences research.
2026-06-23T15:17:35,TSLA,0.2,Battery storage partnership in Europe; EV sales slump offset gains.
2026-06-23T15:17:35,MSFT,0.3,Microsoft completes first Racine County data center; AI infrastructure expansion.
2026-06-23T15:17:35,AMZN,-0.3,AI spending concerns weigh on stock ahead of Prime Day event.
2026-06-22T21:59:19,AAPL,0.2,"Mixed signals: AI strategy reset positive, but iPhone price increases loom."
2026-06-22T21:59:19,NVDA,-0.3,Tech sector selloff; NVDA shares decline amid market uncertainty.
2026-06-22T21:59:19,TSLA,-0.6,Fatal crash under federal investigation; cybersecurity breach exposes trade secrets.
2026-06-22T21:59:19,MSFT,0.6,Major 20-year data center power deal with Chevron; enterprise AI channel expansion.
2026-06-22T21:59:19,AMZN,0.2,AWS expands into industrial AI with ArcelorMittal partnership; tech sector weakness offsets gains.
2026-06-22T19:31:48,AAPL,0.3,AI strategy reset positive; offset by rising memory costs and supply chain breach.
2026-06-22T19:31:48,NVDA,0.6,Major robotics breakthrough with customer adoption of safety tech.
2026-06-22T19:31:48,TSLA,-0.3,Cybersecurity breach exposes Tesla trade secrets; SpaceX merger concerns weigh.
2026-06-22T19:31:48,MSFT,0.3,Enterprise AI expansion with KPMG partnership strengthens channel strategy.
2026-06-22T19:31:48,AMZN,0.6,Prime Day $15.7B forecast and AWS acceleration to 28% growth.
2026-06-22T17:08:31,AAPL,-0.6,Analyst downgrade and Tata cybersecurity breach exposing Apple trade secrets.
2026-06-22T17:08:31,NVDA,-0.3,Tepper trimmed NVDA 13%; SpaceX deal partially offsets positioning shift.
2026-06-22T17:08:31,TSLA,0.2,Operational gains offset by robotaxi delays and valuation concerns.
2026-06-22T17:08:31,MSFT,0.2,AI infrastructure investment secured; sector capex concerns weigh slightly.
2026-06-22T17:08:31,AMZN,-0.6,Berkshire exits Amazon position; AI capex concerns weigh on stock.
2026-06-21T21:09:48,AAPL,0.2,Apple-Intel U.S. chip partnership offsets price hike concerns.
2026-06-21T21:09:48,NVDA,0.0,No NVDA-specific news; macro and sector commentary only.
2026-06-21T21:09:48,TSLA,-0.3,Robotaxi fleet lagging competitors; FSD regulatory headwinds in EU.
2026-06-21T21:09:48,MSFT,0.0,No direct MSFT news; competitive AI landscape remains neutral.
2026-06-21T21:09:48,AMZN,0.35,"AWS reaccelerating, advertising growing, analyst bullish with 36% upside target."
2026-06-21T17:41:20,AAPL,-0.6,Price hikes due to memory costs; potential supply chain shifts to Intel.
2026-06-21T17:41:20,NVDA,0.1,Mixed AI sector sentiment; NVDA supply chain strength noted positively.
2026-06-21T17:41:20,TSLA,-0.3,Robotaxi fleet lagging competitors; FSD regulatory headwinds in EU.
2026-06-21T17:41:20,MSFT,0.0,No direct MSFT news; competitive AI landscape remains neutral.
2026-06-21T17:41:20,AMZN,0.6,"AWS reaccelerating, advertising growing, analyst upgrades with 36% upside target."
2026-06-21T14:26:15,AAPL,-0.3,Price increases due to memory costs offset by potential Intel chip partnership.
2026-06-21T14:26:15,NVDA,0.6,Nvidia invests $2B in Nebius for AI data center expansion.
2026-06-21T14:26:15,TSLA,0.2,FSD progress offset by EU regulatory headwinds and cautious guidance.
2026-06-21T14:26:15,MSFT,-0.3,MSFT exits Oracle data center deal; competitive AI talent losses at rivals.
2026-06-21T14:26:15,AMZN,0.6,"AWS reaccelerating, advertising compounding, custom silicon scaling fast."
2026-06-20T21:11:44,AAPL,0.3,Apple chip manufacturing partnership with Intel; memory cost pressures offset.
2026-06-20T21:11:44,NVDA,0.2,AI trend exposure opportunity; NVDA mentioned in broad chip/datacenter context.
2026-06-20T21:11:44,TSLA,0.3,FSD parking feature improvement; offset by cautious robotaxi/Optimus guidance.
2026-06-20T21:11:44,MSFT,-0.3,Withdrew from Oracle data center deal; CEO warns of AI dominance backlash.
2026-06-20T21:11:44,AMZN,0.0,SpaceX IPO briefly surpassed Amazon market cap; no direct AMZN catalyst.
2026-06-20T17:27:51,AAPL,0.3,Domestic chip manufacturing partnership; memory cost pressures offset gains.
2026-06-20T17:27:51,NVDA,0.2,Nvidia near buy point; included in AI boom positioning strategies.
2026-06-20T17:27:51,TSLA,0.3,FSD parking feature improvement; offset by lowered robotaxi/Optimus expectations.
2026-06-20T17:27:51,MSFT,-0.3,Abandoned Oracle data center deal; CEO warns of AI dominance backlash.
2026-06-20T17:27:51,AMZN,0.5,AWS Graviton5 launch and Prime Day demand signal positive.
2026-06-20T14:21:26,AAPL,0.3,"Apple secures domestic chip manufacturing partnership with Intel, supporting US strategy."
2026-06-20T14:21:26,NVDA,-0.3,"Big Tech leadership waning; financials, industrials, biotech poised for breakout."
2026-06-20T14:21:26,TSLA,0.2,Musk tempers Optimus/Robotaxi expectations; Grok integration feature teased.
2026-06-20T14:21:26,MSFT,0.2,Y Combinator partnership expansion offset by Oracle data center deal withdrawal.
2026-06-20T14:21:26,AMZN,0.4,AWS Graviton5 launch and Prime Day consumer demand signal.
2026-06-19T21:05:06,AAPL,0.3,iPhone pricing increase as Apple pushes AI-driven upgrades.
2026-06-19T21:05:06,NVDA,0.2,AI infrastructure demand supports debt issuance; mixed sentiment on valuations.
2026-06-19T21:05:06,TSLA,0.3,FSD regulatory approvals offset by European roadblocks; Cathie Wood buying support.
2026-06-19T21:05:06,MSFT,-0.7,"Shareholder lawsuit alleges Azure slowdown disclosure failure, stock fell 10%."
2026-06-19T21:05:06,AMZN,0.7,"AWS AI revenue $15B run rate, massive infrastructure spending cycle."
2026-06-19T18:01:03,AAPL,-0.3,Apple CEO confirms price hikes amid AI competition pressure.
2026-06-19T18:01:03,NVDA,0.3,Google AI chip competition offset by analyst upgrades and infrastructure tailwinds.
2026-06-19T18:01:03,TSLA,0.3,FSD approval in Denmark offset by European regulatory headwinds.
2026-06-19T18:01:03,MSFT,-0.7,"Shareholder lawsuit alleges Azure slowdown disclosure failure, stock fell 10%."
2026-06-19T18:01:03,AMZN,0.7,AWS AI revenue $15B run rate; $3T hyperscaler capex cycle underway.
